{
  "$schema": "https://json-schema.org/draft/2020-12/schema",
  "$id": "https://honyx.dev/schemas/package-0.1.json",
  "title": "Honyx package contract 0.1",
  "type": "object",
  "additionalProperties": false,
  "required": ["schema_version", "method", "run"],
  "properties": {
    "schema_version": {"const": "0.1"},
    "method": {
      "type": "object",
      "additionalProperties": false,
      "required": ["id", "version", "title", "question", "document"],
      "properties": {
        "id": {"type": "string", "minLength": 1},
        "version": {"type": "string", "minLength": 1},
        "title": {"type": "string", "minLength": 1},
        "question": {"type": "string", "minLength": 1},
        "document": {"type": "string", "minLength": 1}
      }
    },
    "run": {
      "type": "object",
      "additionalProperties": false,
      "required": ["entrypoint", "inputs", "outputs"],
      "properties": {
        "entrypoint": {
          "type": "array",
          "minItems": 1,
          "items": {"type": "string", "minLength": 1}
        },
        "resources": {
          "type": "array",
          "items": {"$ref": "#/$defs/resource"}
        },
        "inputs": {
          "type": "array",
          "minItems": 1,
          "items": {"$ref": "#/$defs/artifact"}
        },
        "outputs": {
          "type": "array",
          "minItems": 1,
          "items": {"$ref": "#/$defs/output"}
        }
      }
    },
    "verification": {
      "type": "object",
      "additionalProperties": false,
      "properties": {
        "timeout_seconds": {"type": "integer", "minimum": 1}
      }
    }
  },
  "$defs": {
    "resource": {
      "type": "object",
      "additionalProperties": false,
      "required": ["path", "role"],
      "properties": {
        "path": {"type": "string", "minLength": 1},
        "role": {"type": "string", "minLength": 1}
      }
    },
    "artifact": {
      "type": "object",
      "additionalProperties": false,
      "required": ["id", "path", "role"],
      "properties": {
        "id": {"type": "string", "minLength": 1},
        "path": {"type": "string", "minLength": 1},
        "role": {"type": "string", "minLength": 1}
      }
    },
    "output": {
      "type": "object",
      "additionalProperties": false,
      "required": ["id", "path", "role", "comparison"],
      "properties": {
        "id": {"type": "string", "minLength": 1},
        "path": {"type": "string", "minLength": 1},
        "role": {"type": "string", "minLength": 1},
        "comparison": {
          "type": "object",
          "additionalProperties": false,
          "required": ["type"],
          "properties": {
            "type": {"enum": ["exists", "exact", "json"]}
          }
        }
      }
    }
  }
}
