{
  "schema_version": "0.1",
  "method": {
    "id": "group-summary",
    "version": "1.0.0",
    "title": "Per-group measurement summary",
    "question": "What are the count and arithmetic mean of the measurements in each declared group?",
    "document": "METHOD.md"
  },
  "run": {
    "entrypoint": ["python3", "src/analyze.py"],
    "resources": [
      {
        "path": "src",
        "role": "Reference implementation"
      }
    ],
    "inputs": [
      {
        "id": "measurements",
        "path": "inputs/measurements.csv",
        "role": "Observed numeric measurements assigned to experimental groups"
      }
    ],
    "outputs": [
      {
        "id": "group-summary",
        "path": "results/summary.json",
        "role": "Count and arithmetic mean for every group",
        "comparison": {
          "type": "json"
        }
      }
    ]
  },
  "verification": {
    "timeout_seconds": 30
  }
}

